results/test_result_gemm_float16.txt



=============================
  Problem ID: 1

        Provider: [1;37mCUTLASS[0m
   OperationKind: [1;37mgemm[0m
       Operation: cutlass_tensorop_f16_s16816gemm_f16_256x128_32x3_tn_align8

          Status: [1;37mSuccess[0m
    Verification: [1;37mON[0m
     Disposition: [1;32mPassed[0m

reference_device: Passed
          cuBLAS: Not run
           cuDNN: Not run

       Arguments: --gemm_kind=universal --m=512 --n=512 --k=8192 --A=f16:row --B=f16:column --C=f16:column --D=f16:column  \
                  --alpha=1 --beta=0 --split_k_mode=serial --split_k_slices=1 --batch_count=1 --raster_order=heuristic  \
                  --runtime_input_datatype_a=invalid --runtime_input_datatype_b=invalid --use_pdl=false --enable_sm90_mixed_dtype_shuffle_test=false  \
                  --swizzle_size=1 --op_class=tensorop --accum=f32 --cta_m=256 --cta_n=128 --cta_k=32 --cluster_m=1 --cluster_n=1  \
                  --cluster_k=1 --cluster_m_fallback=1 --cluster_n_fallback=1 --cluster_k_fallback=1 --stages=3 --warps_m=4  \
                  --warps_n=2 --warps_k=1 --inst_m=16 --inst_n=8 --inst_k=16 --min_cc=80 --max_cc=1024

           Bytes: 17301504  bytes
           FLOPs: 4295491584  flops
           FLOPs/Byte: 248

         Runtime: 0.417023  ms
          Memory: 38.6388 GiB/s

            Math: 10300.4 GFLOP/s



=============================
  Problem ID: 1

        Provider: [1;37mCUTLASS[0m
   OperationKind: [1;37mgemm[0m
       Operation: cutlass_tensorop_f16_s16816gemm_f16_256x128_32x3_tn_align4

          Status: [1;37mSuccess[0m
    Verification: [1;37mON[0m
     Disposition: [1;32mPassed[0m

reference_device: Passed
          cuBLAS: Not run
           cuDNN: Not run

       Arguments: --gemm_kind=universal --m=512 --n=512 --k=8192 --A=f16:row --B=f16:column --C=f16:column --D=f16:column  \
                  --alpha=1 --beta=0 --split_k_mode=serial --split_k_slices=1 --batch_count=1 --raster_order=heuristic  \
                  --runtime_input_datatype_a=invalid --runtime_input_datatype_b=invalid --use_pdl=false --enable_sm90_mixed_dtype_shuffle_test=false  \
                  --swizzle_size=1 --op_class=tensorop --accum=f32 --cta_m=256 --cta_n=128 --cta_k=32 --cluster_m=1 --cluster_n=1  \
                  --cluster_k=1 --cluster_m_fallback=1 --cluster_n_fallback=1 --cluster_k_fallback=1 --stages=3 --warps_m=4  \
                  --warps_n=2 --warps_k=1 --inst_m=16 --inst_n=8 --inst_k=16 --min_cc=80 --max_cc=1024

           Bytes: 17301504  bytes
           FLOPs: 4295491584  flops
           FLOPs/Byte: 248

         Runtime: 0.420335  ms
          Memory: 38.3343 GiB/s

            Math: 10219.2 GFLOP/s



=============================
  Problem ID: 1

        Provider: [1;37mCUTLASS[0m
   OperationKind: [1;37mgemm[0m
       Operation: cutlass_tensorop_f16_s16816gemm_f16_256x128_32x3_tn_align2

          Status: [1;37mSuccess[0m
    Verification: [1;37mON[0m
     Disposition: [1;32mPassed[0m

reference_device: Passed
          cuBLAS: Not run
           cuDNN: Not run

       Arguments: --gemm_kind=universal --m=512 --n=512 --k=8192 --A=f16:row --B=f16:column --C=f16:column --D=f16:column  \
                  --alpha=1 --beta=0 --split_k_mode=serial --split_k_slices=1 --batch_count=1 --raster_order=heuristic  \
                  --runtime_input_datatype_a=invalid --runtime_input_datatype_b=invalid --use_pdl=false --enable_sm90_mixed_dtype_shuffle_test=false  \
                  --swizzle_size=1 --op_class=tensorop --accum=f32 --cta_m=256 --cta_n=128 --cta_k=32 --cluster_m=1 --cluster_n=1  \
                  --cluster_k=1 --cluster_m_fallback=1 --cluster_n_fallback=1 --cluster_k_fallback=1 --stages=3 --warps_m=4  \
                  --warps_n=2 --warps_k=1 --inst_m=16 --inst_n=8 --inst_k=16 --min_cc=80 --max_cc=1024

           Bytes: 17301504  bytes
           FLOPs: 4295491584  flops
           FLOPs/Byte: 248

         Runtime: 0.605071  ms
          Memory: 26.6304 GiB/s

            Math: 7099.16 GFLOP/s



=============================
  Problem ID: 1

        Provider: [1;37mCUTLASS[0m
   OperationKind: [1;37mgemm[0m
       Operation: cutlass_tensorop_f16_s16816gemm_f16_256x128_64x3_tn_align8

          Status: [1;37mSuccess[0m
    Verification: [1;37mON[0m
     Disposition: [1;32mPassed[0m

reference_device: Passed
          cuBLAS: Not run
           cuDNN: Not run

       Arguments: --gemm_kind=universal --m=512 --n=512 --k=8192 --A=f16:row --B=f16:column --C=f16:column --D=f16:column  \
                  --alpha=1 --beta=0 --split_k_mode=serial --split_k_slices=1 --batch_count=1 --raster_order=heuristic  \
                  --runtime_input_datatype_a=invalid --runtime_input_datatype_b=invalid --use_pdl=false --enable_sm90_mixed_dtype_shuffle_test=false  \
                  --swizzle_size=1 --op_class=tensorop --accum=f32 --cta_m=256 --cta_n=128 --cta_k=64 --cluster_m=1 --cluster_n=1  \
                  --cluster_k=1 --cluster_m_fallback=1 --cluster_n_fallback=1 --cluster_k_fallback=1 --stages=3 --warps_m=4  \
                  --warps_n=2 --warps_k=1 --inst_m=16 --inst_n=8 --inst_k=16 --min_cc=80 --max_cc=1024

           Bytes: 17301504  bytes
           FLOPs: 4295491584  flops
           FLOPs/Byte: 248

         Runtime: 0.29144  ms
          Memory: 55.2885 GiB/s

            Math: 14738.9 GFLOP/s



=============================
  Problem ID: 1

        Provider: [1;37mCUTLASS[0m
   OperationKind: [1;37mgemm[0m
       Operation: cutlass_tensorop_f16_s16816gemm_f16_256x128_64x3_tn_align4

          Status: [1;37mSuccess[0m
    Verification: [1;37mON[0m
     Disposition: [1;32mPassed[0m

reference_device: Passed
          cuBLAS: Not run
           cuDNN: Not run

       Arguments: --gemm_kind=universal --m=512 --n=512 --k=8192 --A=f16:row --B=f16:column --C=f16:column --D=f16:column  \
                  --alpha=1 --beta=0 --split_k_mode=serial --split_k_slices=1 --batch_count=1 --raster_order=heuristic  \
                  --runtime_input_datatype_a=invalid --runtime_input_datatype_b=invalid --use_pdl=false --enable_sm90_mixed_dtype_shuffle_test=false  \
                  --swizzle_size=1 --op_class=tensorop --accum=f32 --cta_m=256 --cta_n=128 --cta_k=64 --cluster_m=1 --cluster_n=1  \
                  --cluster_k=1 --cluster_m_fallback=1 --cluster_n_fallback=1 --cluster_k_fallback=1 --stages=3 --warps_m=4  \
                  --warps_n=2 --warps_k=1 --inst_m=16 --inst_n=8 --inst_k=16 --min_cc=80 --max_cc=1024

           Bytes: 17301504  bytes
           FLOPs: 4295491584  flops
           FLOPs/Byte: 248

         Runtime: 0.33598  ms
          Memory: 47.9591 GiB/s

            Math: 12785 GFLOP/s



=============================
  Problem ID: 1

        Provider: [1;37mCUTLASS[0m
   OperationKind: [1;37mgemm[0m
       Operation: cutlass_tensorop_f16_s16816gemm_f16_256x128_64x3_tn_align2

          Status: [1;37mSuccess[0m
    Verification: [1;37mON[0m
     Disposition: [1;32mPassed[0m

reference_device: Passed
          cuBLAS: Not run
           cuDNN: Not run

       Arguments: --gemm_kind=universal --m=512 --n=512 --k=8192 --A=f16:row --B=f16:column --C=f16:column --D=f16:column  \
                  --alpha=1 --beta=0 --split_k_mode=serial --split_k_slices=1 --batch_count=1 --raster_order=heuristic  \
                  --runtime_input_datatype_a=invalid --runtime_input_datatype_b=invalid --use_pdl=false --enable_sm90_mixed_dtype_shuffle_test=false  \
                  --swizzle_size=1 --op_class=tensorop --accum=f32 --cta_m=256 --cta_n=128 --cta_k=64 --cluster_m=1 --cluster_n=1  \
                  --cluster_k=1 --cluster_m_fallback=1 --cluster_n_fallback=1 --cluster_k_fallback=1 --stages=3 --warps_m=4  \
                  --warps_n=2 --warps_k=1 --inst_m=16 --inst_n=8 --inst_k=16 --min_cc=80 --max_cc=1024

           Bytes: 17301504  bytes
           FLOPs: 4295491584  flops
           FLOPs/Byte: 248

         Runtime: 0.436098  ms
          Memory: 36.9487 GiB/s

            Math: 9849.83 GFLOP/s



=============================
  Problem ID: 1

        Provider: [1;37mCUTLASS[0m
   OperationKind: [1;37mgemm[0m
       Operation: cutlass_tensorop_h16816gemm_256x128_32x3_tn_align8

          Status: [1;37mSuccess[0m
    Verification: [1;37mON[0m
     Disposition: [1;32mPassed[0m

reference_device: Passed
          cuBLAS: Not run
           cuDNN: Not run

       Arguments: --gemm_kind=universal --m=512 --n=512 --k=8192 --A=f16:row --B=f16:column --C=f16:column --D=f16:column  \
                  --alpha=1 --beta=0 --split_k_mode=serial --split_k_slices=1 --batch_count=1 --raster_order=heuristic  \
                  --runtime_input_datatype_a=invalid --runtime_input_datatype_b=invalid --use_pdl=false --enable_sm90_mixed_dtype_shuffle_test=false  \
                  --swizzle_size=1 --op_class=tensorop --accum=f16 --cta_m=256 --cta_n=128 --cta_k=32 --cluster_m=1 --cluster_n=1  \
                  --cluster_k=1 --cluster_m_fallback=1 --cluster_n_fallback=1 --cluster_k_fallback=1 --stages=3 --warps_m=4  \
                  --warps_n=2 --warps_k=1 --inst_m=16 --inst_n=8 --inst_k=16 --min_cc=80 --max_cc=1024

           Bytes: 17301504  bytes
           FLOPs: 4295491584  flops
           FLOPs/Byte: 248

         Runtime: 0.403534  ms
          Memory: 39.9304 GiB/s

            Math: 10644.7 GFLOP/s



=============================
  Problem ID: 1

        Provider: [1;37mCUTLASS[0m
   OperationKind: [1;37mgemm[0m
       Operation: cutlass_tensorop_h16816gemm_256x128_32x3_tn_align4

          Status: [1;37mSuccess[0m
    Verification: [1;37mON[0m
     Disposition: [1;32mPassed[0m

reference_device: Passed
          cuBLAS: Not run
           cuDNN: Not run

       Arguments: --gemm_kind=universal --m=512 --n=512 --k=8192 --A=f16:row --B=f16:column --C=f16:column --D=f16:column  \
                  --alpha=1 --beta=0 --split_k_mode=serial --split_k_slices=1 --batch_count=1 --raster_order=heuristic  \
                  --runtime_input_datatype_a=invalid --runtime_input_datatype_b=invalid --use_pdl=false --enable_sm90_mixed_dtype_shuffle_test=false  \
                  --swizzle_size=1 --op_class=tensorop --accum=f16 --cta_m=256 --cta_n=128 --cta_k=32 --cluster_m=1 --cluster_n=1  \
                  --cluster_k=1 --cluster_m_fallback=1 --cluster_n_fallback=1 --cluster_k_fallback=1 --stages=3 --warps_m=4  \
                  --warps_n=2 --warps_k=1 --inst_m=16 --inst_n=8 --inst_k=16 --min_cc=80 --max_cc=1024

           Bytes: 17301504  bytes
           FLOPs: 4295491584  flops
           FLOPs/Byte: 248

         Runtime: 0.406227  ms
          Memory: 39.6657 GiB/s

            Math: 10574.1 GFLOP/s



=============================
  Problem ID: 1

        Provider: [1;37mCUTLASS[0m
   OperationKind: [1;37mgemm[0m
       Operation: cutlass_tensorop_h16816gemm_256x128_32x3_tn_align2

          Status: [1;37mSuccess[0m
    Verification: [1;37mON[0m
     Disposition: [1;32mPassed[0m

reference_device: Passed
          cuBLAS: Not run
           cuDNN: Not run

       Arguments: --gemm_kind=universal --m=512 --n=512 --k=8192 --A=f16:row --B=f16:column --C=f16:column --D=f16:column  \
                  --alpha=1 --beta=0 --split_k_mode=serial --split_k_slices=1 --batch_count=1 --raster_order=heuristic  \
                  --runtime_input_datatype_a=invalid --runtime_input_datatype_b=invalid --use_pdl=false --enable_sm90_mixed_dtype_shuffle_test=false  \
                  --swizzle_size=1 --op_class=tensorop --accum=f16 --cta_m=256 --cta_n=128 --cta_k=32 --cluster_m=1 --cluster_n=1  \
                  --cluster_k=1 --cluster_m_fallback=1 --cluster_n_fallback=1 --cluster_k_fallback=1 --stages=3 --warps_m=4  \
                  --warps_n=2 --warps_k=1 --inst_m=16 --inst_n=8 --inst_k=16 --min_cc=80 --max_cc=1024

           Bytes: 17301504  bytes
           FLOPs: 4295491584  flops
           FLOPs/Byte: 248

         Runtime: 0.598237  ms
          Memory: 26.9346 GiB/s

            Math: 7180.25 GFLOP/s



=============================
  Problem ID: 1

        Provider: [1;37mCUTLASS[0m
   OperationKind: [1;37mgemm[0m
       Operation: cutlass_tensorop_h16816gemm_256x128_64x3_tn_align8

          Status: [1;37mSuccess[0m
    Verification: [1;37mON[0m
     Disposition: [1;32mPassed[0m

reference_device: Passed
          cuBLAS: Not run
           cuDNN: Not run

       Arguments: --gemm_kind=universal --m=512 --n=512 --k=8192 --A=f16:row --B=f16:column --C=f16:column --D=f16:column  \
                  --alpha=1 --beta=0 --split_k_mode=serial --split_k_slices=1 --batch_count=1 --raster_order=heuristic  \
                  --runtime_input_datatype_a=invalid --runtime_input_datatype_b=invalid --use_pdl=false --enable_sm90_mixed_dtype_shuffle_test=false  \
                  --swizzle_size=1 --op_class=tensorop --accum=f16 --cta_m=256 --cta_n=128 --cta_k=64 --cluster_m=1 --cluster_n=1  \
                  --cluster_k=1 --cluster_m_fallback=1 --cluster_n_fallback=1 --cluster_k_fallback=1 --stages=3 --warps_m=4  \
                  --warps_n=2 --warps_k=1 --inst_m=16 --inst_n=8 --inst_k=16 --min_cc=80 --max_cc=1024

           Bytes: 17301504  bytes
           FLOPs: 4295491584  flops
           FLOPs/Byte: 248

         Runtime: 0.282378  ms
          Memory: 57.0628 GiB/s

            Math: 15211.8 GFLOP/s



=============================
  Problem ID: 1

        Provider: [1;37mCUTLASS[0m
   OperationKind: [1;37mgemm[0m
       Operation: cutlass_tensorop_h16816gemm_256x128_64x3_tn_align4

          Status: [1;37mSuccess[0m
    Verification: [1;37mON[0m
     Disposition: [1;32mPassed[0m

reference_device: Passed
          cuBLAS: Not run
           cuDNN: Not run

       Arguments: --gemm_kind=universal --m=512 --n=512 --k=8192 --A=f16:row --B=f16:column --C=f16:column --D=f16:column  \
                  --alpha=1 --beta=0 --split_k_mode=serial --split_k_slices=1 --batch_count=1 --raster_order=heuristic  \
                  --runtime_input_datatype_a=invalid --runtime_input_datatype_b=invalid --use_pdl=false --enable_sm90_mixed_dtype_shuffle_test=false  \
                  --swizzle_size=1 --op_class=tensorop --accum=f16 --cta_m=256 --cta_n=128 --cta_k=64 --cluster_m=1 --cluster_n=1  \
                  --cluster_k=1 --cluster_m_fallback=1 --cluster_n_fallback=1 --cluster_k_fallback=1 --stages=3 --warps_m=4  \
                  --warps_n=2 --warps_k=1 --inst_m=16 --inst_n=8 --inst_k=16 --min_cc=80 --max_cc=1024

           Bytes: 17301504  bytes
           FLOPs: 4295491584  flops
           FLOPs/Byte: 248

         Runtime: 0.331872  ms
          Memory: 48.5527 GiB/s

            Math: 12943.2 GFLOP/s



=============================
  Problem ID: 1

        Provider: [1;37mCUTLASS[0m
   OperationKind: [1;37mgemm[0m
       Operation: cutlass_tensorop_h16816gemm_256x128_64x3_tn_align2

          Status: [1;37mSuccess[0m
    Verification: [1;37mON[0m
     Disposition: [1;32mPassed[0m

reference_device: Passed
          cuBLAS: Not run
           cuDNN: Not run

       Arguments: --gemm_kind=universal --m=512 --n=512 --k=8192 --A=f16:row --B=f16:column --C=f16:column --D=f16:column  \
                  --alpha=1 --beta=0 --split_k_mode=serial --split_k_slices=1 --batch_count=1 --raster_order=heuristic  \
                  --runtime_input_datatype_a=invalid --runtime_input_datatype_b=invalid --use_pdl=false --enable_sm90_mixed_dtype_shuffle_test=false  \
                  --swizzle_size=1 --op_class=tensorop --accum=f16 --cta_m=256 --cta_n=128 --cta_k=64 --cluster_m=1 --cluster_n=1  \
                  --cluster_k=1 --cluster_m_fallback=1 --cluster_n_fallback=1 --cluster_k_fallback=1 --stages=3 --warps_m=4  \
                  --warps_n=2 --warps_k=1 --inst_m=16 --inst_n=8 --inst_k=16 --min_cc=80 --max_cc=1024

           Bytes: 17301504  bytes
           FLOPs: 4295491584  flops
           FLOPs/Byte: 248

         Runtime: 0.426445  ms
          Memory: 37.7851 GiB/s

            Math: 10072.8 GFLOP/s


=============================

CSV Results:

Problem,Provider,OperationKind,Operation,Disposition,Status,gemm_kind,m,n,k,A,B,C,D,alpha,beta,split_k_mode,split_k_slices,batch_count,raster_order,runtime_input_datatype_a,runtime_input_datatype_b,use_pdl,enable_sm90_mixed_dtype_shuffle_test,swizzle_size,op_class,accum,cta_m,cta_n,cta_k,cluster_m,cluster_n,cluster_k,cluster_m_fallback,cluster_n_fallback,cluster_k_fallback,stages,warps_m,warps_n,warps_k,inst_m,inst_n,inst_k,min_cc,max_cc,Bytes,Flops,Flops/Byte,Runtime,GB/s,GFLOPs
1,CUTLASS,gemm,cutlass_tensorop_f16_s16816gemm_f16_256x128_32x3_tn_align8,passed,success,universal,512,512,8192,f16:row,f16:column,f16:column,f16:column,1,0,serial,1,1,heuristic,invalid,invalid,false,false,1,tensorop,f32,256,128,32,1,1,1,1,1,1,3,4,2,1,16,8,16,80,1024,17301504,4295491584,248,0.417023,38.6388,10300.4
1,CUTLASS,gemm,cutlass_tensorop_f16_s16816gemm_f16_256x128_32x3_tn_align4,passed,success,universal,512,512,8192,f16:row,f16:column,f16:column,f16:column,1,0,serial,1,1,heuristic,invalid,invalid,false,false,1,tensorop,f32,256,128,32,1,1,1,1,1,1,3,4,2,1,16,8,16,80,1024,17301504,4295491584,248,0.420335,38.3343,10219.2
1,CUTLASS,gemm,cutlass_tensorop_f16_s16816gemm_f16_256x128_32x3_tn_align2,passed,success,universal,512,512,8192,f16:row,f16:column,f16:column,f16:column,1,0,serial,1,1,heuristic,invalid,invalid,false,false,1,tensorop,f32,256,128,32,1,1,1,1,1,1,3,4,2,1,16,8,16,80,1024,17301504,4295491584,248,0.605071,26.6304,7099.16
1,CUTLASS,gemm,cutlass_tensorop_f16_s16816gemm_f16_256x128_64x3_tn_align8,passed,success,universal,512,512,8192,f16:row,f16:column,f16:column,f16:column,1,0,serial,1,1,heuristic,invalid,invalid,false,false,1,tensorop,f32,256,128,64,1,1,1,1,1,1,3,4,2,1,16,8,16,80,1024,17301504,4295491584,248,0.29144,55.2885,14738.9
1,CUTLASS,gemm,cutlass_tensorop_f16_s16816gemm_f16_256x128_64x3_tn_align4,passed,success,universal,512,512,8192,f16:row,f16:column,f16:column,f16:column,1,0,serial,1,1,heuristic,invalid,invalid,false,false,1,tensorop,f32,256,128,64,1,1,1,1,1,1,3,4,2,1,16,8,16,80,1024,17301504,4295491584,248,0.33598,47.9591,12785
1,CUTLASS,gemm,cutlass_tensorop_f16_s16816gemm_f16_256x128_64x3_tn_align2,passed,success,universal,512,512,8192,f16:row,f16:column,f16:column,f16:column,1,0,serial,1,1,heuristic,invalid,invalid,false,false,1,tensorop,f32,256,128,64,1,1,1,1,1,1,3,4,2,1,16,8,16,80,1024,17301504,4295491584,248,0.436098,36.9487,9849.83
1,CUTLASS,gemm,cutlass_tensorop_h16816gemm_256x128_32x3_tn_align8,passed,success,universal,512,512,8192,f16:row,f16:column,f16:column,f16:column,1,0,serial,1,1,heuristic,invalid,invalid,false,false,1,tensorop,f16,256,128,32,1,1,1,1,1,1,3,4,2,1,16,8,16,80,1024,17301504,4295491584,248,0.403534,39.9304,10644.7
1,CUTLASS,gemm,cutlass_tensorop_h16816gemm_256x128_32x3_tn_align4,passed,success,universal,512,512,8192,f16:row,f16:column,f16:column,f16:column,1,0,serial,1,1,heuristic,invalid,invalid,false,false,1,tensorop,f16,256,128,32,1,1,1,1,1,1,3,4,2,1,16,8,16,80,1024,17301504,4295491584,248,0.406227,39.6657,10574.1
1,CUTLASS,gemm,cutlass_tensorop_h16816gemm_256x128_32x3_tn_align2,passed,success,universal,512,512,8192,f16:row,f16:column,f16:column,f16:column,1,0,serial,1,1,heuristic,invalid,invalid,false,false,1,tensorop,f16,256,128,32,1,1,1,1,1,1,3,4,2,1,16,8,16,80,1024,17301504,4295491584,248,0.598237,26.9346,7180.25
1,CUTLASS,gemm,cutlass_tensorop_h16816gemm_256x128_64x3_tn_align8,passed,success,universal,512,512,8192,f16:row,f16:column,f16:column,f16:column,1,0,serial,1,1,heuristic,invalid,invalid,false,false,1,tensorop,f16,256,128,64,1,1,1,1,1,1,3,4,2,1,16,8,16,80,1024,17301504,4295491584,248,0.282378,57.0628,15211.8
1,CUTLASS,gemm,cutlass_tensorop_h16816gemm_256x128_64x3_tn_align4,passed,success,universal,512,512,8192,f16:row,f16:column,f16:column,f16:column,1,0,serial,1,1,heuristic,invalid,invalid,false,false,1,tensorop,f16,256,128,64,1,1,1,1,1,1,3,4,2,1,16,8,16,80,1024,17301504,4295491584,248,0.331872,48.5527,12943.2
1,CUTLASS,gemm,cutlass_tensorop_h16816gemm_256x128_64x3_tn_align2,passed,success,universal,512,512,8192,f16:row,f16:column,f16:column,f16:column,1,0,serial,1,1,heuristic,invalid,invalid,false,false,1,tensorop,f16,256,128,64,1,1,1,1,1,1,3,4,2,1,16,8,16,80,1024,17301504,4295491584,248,0.426445,37.7851,10072.8
