results/test_result_spgemm_float16.txt



=============================
  Problem ID: 1

        Provider: [1;37mCUTLASS[0m
   OperationKind: [1;37mspgemm[0m
       Operation: cutlass_tensorop_s16832spgemm_f16_256x128_64x3_tn_align8

          Status: [1;37mSuccess[0m
    Verification: [1;37mON[0m
     Disposition: [0mNot verified[0m

reference_device: Not run
          cuBLAS: Not run
           cuDNN: Not run

       Arguments: --gemm_kind=spgemm --m=512 --n=512 --k=8192 --A=f16:row --B=f16:column --C=f32:row --E=u16:nk2 --alpha=1  \
                  --beta=0 --split_k_slices=1 --batch_count=1 --op_class=tensorop --accum=f32 --cta_m=256 --cta_n=128  \
                  --cta_k=64 --cluster_m=1 --cluster_n=1 --cluster_k=1 --stages=3 --warps_m=4 --warps_n=2 --warps_k=1  \
                  --inst_m=16 --inst_n=8 --inst_k=32 --min_cc=80 --max_cc=1024

           Bytes: 14155776  bytes
           FLOPs: 4295491584  flops
           FLOPs/Byte: 303

         Runtime: 0.226983  ms
          Memory: 58.0818 GiB/s

            Math: 18924.3 GFLOP/s


=============================

CSV Results:

Problem,Provider,OperationKind,Operation,Disposition,Status,gemm_kind,m,n,k,A,B,C,E,alpha,beta,split_k_slices,batch_count,op_class,accum,cta_m,cta_n,cta_k,cluster_m,cluster_n,cluster_k,cluster_m_fallback,cluster_n_fallback,cluster_k_fallback,stages,warps_m,warps_n,warps_k,inst_m,inst_n,inst_k,min_cc,max_cc,Bytes,Flops,Flops/Byte,Runtime,GB/s,GFLOPs
1,CUTLASS,spgemm,cutlass_tensorop_s16832spgemm_f16_256x128_64x3_tn_align8,not_verified,success,spgemm,512,512,8192,f16:row,f16:column,f32:row,u16:nk2,1,0,1,1,tensorop,f32,256,128,64,1,1,1,,,,3,4,2,1,16,8,32,80,1024,14155776,4295491584,303,0.226983,58.0818,18924.3
